dealer,review_text,source,clean_review,word_count,tb_polarity,vader_compound,sentiment
Tom Wood Toyota,"hour.  Tires rotated and inspected, motor oil completed",DealerRater,"hour. tires rotated and inspected, motor oil completed",8,0.0,0.0,Neutral
Tom Wood Toyota,Comfortable lounge to wait in with TV and drinks.,DealerRater,comfortable lounge to wait in with tv and drinks.,9,0.4,0.5106,Positive
Tom Wood Toyota,friendly. Did not have to wait beyond expectations.,DealerRater,friendly. did not have to wait beyond expectations.,8,0.375,0.4939,Positive
Tom Wood Toyota,Grateful for his work!   I recommend Tom Wood Toyota.,DealerRater,grateful for his work! i recommend tom wood toyota.,9,0.0,0.6996,Positive
Tom Wood Toyota,professional and very friend and made sure very informed of every detail. My wife and me enjoyed our experience very much!!!!! We got a great deal on our new vehicle.,DealerRater,professional and very friend and made sure very informed of every detail. my wife and me enjoyed our experience very much!!!!! we got a great deal on our new vehicle.,30,0.4037275834517045,0.9367,Positive
Tom Wood Toyota,I would recommend them highly. They made it convenient and easy to test drive and buy a car!,DealerRater,i would recommend them highly. they made it convenient and easy to test drive and buy a car!,18,0.3508333333333334,0.69,Positive
Tom Wood Toyota,"ET was very professional and helpful in making sure I know everything about my new car.  If you have a choice of Sales People, choose ET!",DealerRater,"et was very professional and helpful in making sure i know everything about my new car. if you have a choice of sales people, choose et!",26,0.2668181818181818,0.6864,Positive
Tom Wood Toyota,"I took my car to Tom Wood Toyota for new tires, and they damaged my wheels during the process. Instead of taking responsibility, they refused to acknowledge the issue and wouldn't fix the damage they caused. I expected professional service, but this experience has been nothing but frustrating and disappointing. If you care about your vehicle, I strongly recommend avoiding this dealership. The lack of accountability and customer care is alarming. Take your business elsewhere!",DealerRater,"i took my car to tom wood toyota for new tires, and they damaged my wheels during the process. instead of taking responsibility, they refused to acknowledge the issue and wouldn't fix the damage they caused. i expected professional service, but this experience has been nothing but frustrating and disappointing. if you care about your vehicle, i strongly recommend avoiding this dealership. the lack of accountability and customer care is alarming. take your business elsewhere!",75,-0.07932900432900433,0.724,Positive
Tom Wood Toyota,Very professional and courteous service staff. I just had them put new tires on . Chris was very knowledgeable and personable. Will continue to use them for my service needs,DealerRater,very professional and courteous service staff. i just had them put new tires on . chris was very knowledgeable and personable. will continue to use them for my service needs,30,0.2665909090909091,0.552,Positive
Tom Wood Toyota,Tom Wood Toyota service desk is the best in service provided.   Improvement idea: Stock more tires when on special.,DealerRater,tom wood toyota service desk is the best in service provided. improvement idea: stock more tires when on special.,19,0.6190476190476191,0.872,Positive
Tom Wood Toyota,I have a 2023 Toyota RAV4 and got it serviced for its reg maintenance.  Nick was awesome.  He kept me updated in the process and had a quick turn an around timeframe. Always polite and helpful! Thank you for great service!,DealerRater,i have a 2023 toyota rav4 and got it serviced for its reg maintenance. nick was awesome. he kept me updated in the process and had a quick turn an around timeframe. always polite and helpful! thank you for great service!,41,0.8055555555555555,0.9335,Positive
Uebelhor & Sons Toyota,"Their quality of work is awesome!  Prices are reasonable.   They start the repair or service on time and complete in a timely manner 

.",DealerRater,their quality of work is awesome! prices are reasonable. they start the repair or service on time and complete in a timely manner .,24,0.43333333333333335,0.6588,Positive
Uebelhor & Sons Toyota,Confident & does Business in a Professional Fashion,DealerRater,confident & does business in a professional fashion,8,0.3,0.4939,Positive
Uebelhor & Sons Toyota,Everyone at dealership were polite and helpfull. Would Highly recommend this dealership and Brian my salesman,DealerRater,everyone at dealership were polite and helpfull. would highly recommend this dealership and brian my salesman,16,0.16,0.4201,Positive
Uebelhor & Sons Toyota,The service department is always excellent.  Service was very quick. Waiting area clean and comfortable.,DealerRater,the service department is always excellent. service was very quick. waiting area clean and comfortable.,15,0.55,0.8658,Positive
Uebelhor & Sons Toyota,Everyone was so friendly. There was no pressure. I enjoyed my experience with everyone especially Amanda Dearing. She was the best!!  So kind and very informative on the car I wanted. Great salesperson!!I,DealerRater,everyone was so friendly. there was no pressure. i enjoyed my experience with everyone especially amanda dearing. she was the best!! so kind and very informative on the car i wanted. great salesperson!!i,33,0.4964285714285715,0.9754,Positive
Uebelhor & Sons Toyota,"walked around. Everyone said Hello to Charlie, he likes attention.  Sarah got us in and out!",DealerRater,"walked around. everyone said hello to charlie, he likes attention. sarah got us in and out!",16,0.0,0.4753,Positive
Uebelhor & Sons Toyota,Larry was extremely helpful and patient. Great experience! Will only buy from here,DealerRater,larry was extremely helpful and patient. great experience! will only buy from here,13,0.2916666666666667,0.8169,Positive
Uebelhor & Sons Toyota,Super happy  that I have my car back in such a short time,DealerRater,super happy that i have my car back in such a short time,13,0.22666666666666666,0.8225,Positive
Uebelhor & Sons Toyota,Matthew was great at communicating the problem and getting my truck fixed promptly.,DealerRater,matthew was great at communicating the problem and getting my truck fixed promptly.,13,0.45,0.34,Positive
Uebelhor & Sons Toyota,all my questions and concerns were dealt with quickly.  highly recommend,DealerRater,all my questions and concerns were dealt with quickly. highly recommend,11,0.16,0.4201,Positive
Uebelhor & Sons Toyota,"Explained well details of what was needed for my vehicle. Kind, good attitudes.",DealerRater,"explained well details of what was needed for my vehicle. kind, good attitudes.",13,0.6499999999999999,0.8126,Positive
Uebelhor & Sons Toyota,service in the same place thanks you again,DealerRater,service in the same place thanks you again,8,0.1,0.4404,Positive
Uebelhor & Sons Toyota,Great service - seamless process in picking up our new vehicle.,DealerRater,great service - seamless process in picking up our new vehicle.,11,0.34545454545454546,0.6249,Positive
Uebelhor & Sons Toyota,one was very helpful and happy,DealerRater,one was very helpful and happy,6,0.5,0.7939,Positive
Uebelhor & Sons Toyota,Cody was very helpful. He was able to take care of the issue for me. Thank you!,DealerRater,cody was very helpful. he was able to take care of the issue for me. thank you!,17,0.4125,0.8436,Positive
Uebelhor & Sons Toyota,Sales department is always nice and not pushy. Great service and locally owner,DealerRater,sales department is always nice and not pushy. great service and locally owner,13,0.4666666666666666,0.0823,Positive
Uebelhor & Sons Toyota,of all things that had been serviced and explained things needed in the future,DealerRater,of all things that had been serviced and explained things needed in the future,14,0.0,0.0,Neutral
Uebelhor & Sons Toyota,"time,everything was fixed perfectly,even picked the vehicle up and returned it.excellent experience",DealerRater,"time,everything was fixed perfectly,even picked the vehicle up and returned it.excellent experience",12,0.1,0.0,Neutral
Uebelhor & Sons Toyota,Waiting area is very clean I left feeling good about how my vehicle is getting cared for,DealerRater,waiting area is very clean i left feeling good about how my vehicle is getting cared for,17,0.39222222222222225,0.8479,Positive
Uebelhor & Sons Toyota,recall’s also! I scheduled them for another time! The oil change did not take long!,DealerRater,recall’s also! i scheduled them for another time! the oil change did not take long!,15,-0.0625,0.0,Neutral
Uebelhor & Sons Toyota,My service was quick and was explained to me by service employee.,DealerRater,my service was quick and was explained to me by service employee.,12,0.3333333333333333,0.0,Neutral
Uebelhor & Sons Toyota,Service waiting area was nice. Very satisfied the service and how Matthew handled the appointment.,DealerRater,service waiting area was nice. very satisfied the service and how matthew handled the appointment.,15,0.625,0.7089,Positive
Uebelhor & Sons Toyota,"Quick accurate  and trustworthy service.  Would highly recommend Ubelor Toyota in Jasper, IN",DealerRater,"quick accurate and trustworthy service. would highly recommend ubelor toyota in jasper, in",13,0.2977777777777778,0.7501,Positive
Uebelhor & Sons Toyota,Received the service I asked for and was made aware of extended replacement of parts.  Cost was made minimal due to proper replacement due to time.  Time required was managed to keep cost at a minimum.  Will continue to use Uebelhor in the further for purchases and service.,DealerRater,received the service i asked for and was made aware of extended replacement of parts. cost was made minimal due to proper replacement due to time. time required was managed to keep cost at a minimum. will continue to use uebelhor in the further for purchases and service.,48,-0.016666666666666666,0.0,Neutral
Uebelhor & Sons Toyota,"Very professional and courteous, and the service  technician are honest very good at their jobs",DealerRater,"very professional and courteous, and the service technician are honest very good at their jobs",15,0.56,0.8766,Positive
Uebelhor & Sons Toyota,was no problem at all. Everyone was helpful and friendly and I was in and out in less than 30 minutes.,DealerRater,was no problem at all. everyone was helpful and friendly and i was in and out in less than 30 minutes.,21,0.10416666666666667,0.8052,Positive
Uebelhor & Sons Toyota,Quick and easy drop off. Friendly and knowledgeable staff. Great team! I was impressed.,DealerRater,quick and easy drop off. friendly and knowledgeable staff. great team! i was impressed.,14,0.6283333333333333,0.9098,Positive
Uebelhor & Sons Toyota,us. We appreciate it!,DealerRater,us. we appreciate it!,4,0.0,0.4574,Positive
Uebelhor & Sons Toyota,exactly what work would be completed.,DealerRater,exactly what work would be completed.,6,0.25,0.0,Neutral
Uebelhor & Sons Toyota,No one here cares about anything. No fees but the sales price and trade in value is where they get you back for it. Had to sell mine to carvana. They wouldn't even match it with letting them steal the value in trade ins tax credits of 1k$ still off by 500$ Pathetic if you ask me. They had the car in stock and I wanted it fast. I hope to never be in this situation again and would be happy to never darken the doorway of a eubelhor represented store again.,DealerRater,no one here cares about anything. no fees but the sales price and trade in value is where they get you back for it. had to sell mine to carvana. they wouldn't even match it with letting them steal the value in trade ins tax credits of 1k$ still off by 500$ pathetic if you ask me. they had the car in stock and i wanted it fast. i hope to never be in this situation again and would be happy to never darken the doorway of a eubelhor represented store again.,92,0.0,0.8316,Positive
Uebelhor & Sons Toyota,afternoon. Not not not not,DealerRater,afternoon. not not not not,5,0.0,0.0,Neutral
Uebelhor & Sons Toyota,experience. We were treated very well.,DealerRater,experience. we were treated very well.,6,0.2,0.3384,Positive
Uebelhor & Sons Toyota,They are always ready to answer any question you may have !,DealerRater,they are always ready to answer any question you may have !,12,0.25,0.4199,Positive
Uebelhor & Sons Toyota,I will highly recommend to my friends and family,DealerRater,i will highly recommend to my friends and family,9,0.16,0.7089,Positive
Uebelhor & Sons Toyota,and it’s expected due date,DealerRater,and it’s expected due date,5,-0.1125,0.0,Neutral
Uebelhor & Sons Toyota,"They were supposed to change it at the 10k mile service. They didn’t change it.. I will not pick up until it is changed. 
Service has not been good.
Probably change back to using Kenny Kent.",DealerRater,they were supposed to change it at the 10k mile service. they didn’t change it.. i will not pick up until it is changed. service has not been good. probably change back to using kenny kent.,36,0.35,-0.3412,Negative
Uebelhor & Sons Toyota,"professionally. 
Everyone was very kind and helpful, especially Judd Goodness.",DealerRater,"professionally. everyone was very kind and helpful, especially judd goodness.",10,0.29333333333333333,0.876,Positive
Uebelhor & Sons Toyota,care of our needs and questions.,DealerRater,care of our needs and questions.,6,0.0,0.4939,Positive
Uebelhor & Sons Toyota,Very helpful and professional.  Answered all our questions and gave us a very good.  Would encourage anyone to see him for a new vehicle.,DealerRater,very helpful and professional. answered all our questions and gave us a very good. would encourage anyone to see him for a new vehicle.,24,0.33659090909090905,0.8705,Positive
Uebelhor & Sons Toyota,The sales lady Amanda was EXCELLENT.  The finance lady was not the most pleasant to work with.,DealerRater,the sales lady amanda was excellent. the finance lady was not the most pleasant to work with.,17,0.7444444444444445,0.1977,Positive
Uebelhor & Sons Toyota,"years.Cody was awesome l, will definitely go back for service maintenance or new vehicle",DealerRater,"years.cody was awesome l, will definitely go back for service maintenance or new vehicle",14,0.37878787878787873,0.7783,Positive
Uebelhor & Sons Toyota,reasonably priced.  It’s always near  & clean as well,DealerRater,reasonably priced. it’s always near & clean as well,9,0.22222222222222224,0.5859,Positive
Uebelhor & Sons Toyota,"with. Corey was knowledgeable, professional, and personable through the car buying process. I would recommend this dealership to anyone buying a vehicle.",DealerRater,"with. corey was knowledgeable, professional, and personable through the car buying process. i would recommend this dealership to anyone buying a vehicle.",22,0.1,0.3612,Positive
Uebelhor & Sons Toyota,That's why I always drive from Owensboro Kentucky for service.,DealerRater,that's why i always drive from owensboro kentucky for service.,10,0.0,0.0,Neutral
Uebelhor & Sons Toyota,"manner, I feel like I can really trust them",DealerRater,"manner, i feel like i can really trust them",9,0.2,0.7264,Positive
Uebelhor & Sons Toyota,"BRAKES"" AND AVOIDED HITTING A YOUNG BOY ON A BIKE ( HE DIDN'T STOP AT A STOP SIGN) ! THANK GOD FOR TODAY'S WORK AT UEBELHOR  ! THANKS TO CODY SCHMITT'S RECOMMENDATIONS. WE'RE SO HAPPY WE CRIED !!!!",DealerRater,"brakes"" and avoided hitting a young boy on a bike ( he didn't stop at a stop sign) ! thank god for today's work at uebelhor ! thanks to cody schmitt's recommendations. we're so happy we cried !!!!",38,0.45208333333333334,0.8331,Positive
Uebelhor & Sons Toyota,Has been for many years.,DealerRater,has been for many years.,5,0.5,0.0,Neutral
Uebelhor & Sons Toyota,purchase! Entire transaction was a breeze!,DealerRater,purchase! entire transaction was a breeze!,6,0.0,0.0,Neutral
Uebelhor & Sons Toyota,Fast and excellent. Thank you!!!!!!! Nice lounge area. And great clean bathroom. We like looking at cars too,DealerRater,fast and excellent. thank you!!!!!!! nice lounge area. and great clean bathroom. we like looking at cars too,18,0.5933333333333333,0.9611,Positive
Uebelhor & Sons Toyota,"friendly, and Jay Jones
Ask if we needed anything he is the salesman that sold us the RAV4, PS
Sandy said the coffee was outstanding.
Again Thank You
Tony & Sandy",DealerRater,"friendly, and jay jones ask if we needed anything he is the salesman that sold us the rav4, ps sandy said the coffee was outstanding. again thank you tony & sandy",31,0.4375,0.8658,Positive
Evans Toyota,informed about my service needs. I felt very much at ease.,DealerRater,informed about my service needs. i felt very much at ease.,11,0.26,0.4144,Positive
Evans Toyota,and you go to get a check.,DealerRater,and you go to get a check.,7,0.0,0.0,Neutral
Evans Toyota,"Tacoma. 
Evans workers were friendly. 

Kelli",DealerRater,tacoma. evans workers were friendly. kelli,6,0.375,0.4939,Positive
Evans Toyota,will give my business to Evans here on out.,DealerRater,will give my business to evans here on out.,9,0.0,0.0,Neutral
Evans Toyota,department with my lift kit on my Tacoma.  He is an absolute pleasure to do business with and recommend him and the team at Evans for all services and sales needs.  John represents Evans in the most positive and professional way.  Thanks John.  Also want to thank Jerry White for installing the suspension lift on the truck.  He did a phenomenal job and kept me updated on everything during the process and gave needed recommendations necessary for the installation.  Having great mechanics and service advisors like Jerry and John keep me coming back.,DealerRater,department with my lift kit on my tacoma. he is an absolute pleasure to do business with and recommend him and the team at evans for all services and sales needs. john represents evans in the most positive and professional way. thanks john. also want to thank jerry white for installing the suspension lift on the truck. he did a phenomenal job and kept me updated on everything during the process and gave needed recommendations necessary for the installation. having great mechanics and service advisors like jerry and john keep me coming back.,93,0.25272727272727274,0.9698,Positive
Evans Toyota,"helpful in meeting our needs for a new RAV4 for the wife.  We highly recommend the people at Evans Toyota for you future needs, and we thank them for happy wife, happy life:)
God bless you all!",DealerRater,"helpful in meeting our needs for a new rav4 for the wife. we highly recommend the people at evans toyota for you future needs, and we thank them for happy wife, happy life:) god bless you all!",37,0.4202272727272727,0.9622,Positive
Evans Toyota,"fantastic! Recker helped me navigate new vs. used SUVs. After we decided on a new RAV4 Hybrid he helped me narrow down my trim options. He was very pleasant to work with and helped with all of my questions. We ended up hammering out a deal 5 days ago and I took my car home that night. He has continued to help me even after my purchase with questions and a concern I had. 10 out of 10 would recommend him for salesman of the year. Thank you so much for your patience and your expertise Ryan!!

I am also a fan of Chris in finance. He walked me through everything and answered all of my questions. I didn’t feel rushed or pressured into anything I didn’t want. Thank you Chris!

Great experience at Evans!!",DealerRater,fantastic! recker helped me navigate new vs. used suvs. after we decided on a new rav4 hybrid he helped me narrow down my trim options. he was very pleasant to work with and helped with all of my questions. we ended up hammering out a deal 5 days ago and i took my car home that night. he has continued to help me even after my purchase with questions and a concern i had. 10 out of 10 would recommend him for salesman of the year. thank you so much for your patience and your expertise ryan!! i am also a fan of chris in finance. he walked me through everything and answered all of my questions. i didn’t feel rushed or pressured into anything i didn’t want. thank you chris! great experience at evans!!,135,0.3451412563131313,0.9731,Positive
Evans Toyota,"Toyato cars/truck I’ve purchased. He is professional, friendly, and really knows his product. I trust him completely and know he will work with me to attempt to get the best deal possible.. After many years of dealing with Reggie, I feel we have become exceptionally good friends.",DealerRater,"toyato cars/truck i’ve purchased. he is professional, friendly, and really knows his product. i trust him completely and know he will work with me to attempt to get the best deal possible.. after many years of dealing with reggie, i feel we have become exceptionally good friends.",47,0.37187499999999996,0.9536,Positive
Evans Toyota,"of my 2013 Toyota Highlander. I’m thrilled with my new vehicle, got a great deal, they even replaced a lock and found a missing seat before I picked it up. They took very good care of me and made sure I was completely satisfied with my new vehicle! Evans Toyota is the best! Even providing two free oil changes and tire rotations on your new vehicle! I highly recommend them!",DealerRater,"of my 2013 toyota highlander. i’m thrilled with my new vehicle, got a great deal, they even replaced a lock and found a missing seat before i picked it up. they took very good care of me and made sure i was completely satisfied with my new vehicle! evans toyota is the best! even providing two free oil changes and tire rotations on your new vehicle! i highly recommend them!",70,0.4322727272727273,0.9823,Positive
Evans Toyota,You did an amazing job on my new car.  It looks great.,DealerRater,you did an amazing job on my new car. it looks great.,12,0.5121212121212122,0.836,Positive
Evans Toyota,"purchase of my 2024 Prius,
Thanks Reggie for having a kind gracious discerning heart.",DealerRater,"purchase of my 2024 prius, thanks reggie for having a kind gracious discerning heart.",14,0.4,0.9337,Positive
Evans Toyota,"environment is very welcoming as well as all of the employees. Justin goes above and beyond, and make sure that your vehicle is working efficiently before you walk out the door.",DealerRater,"environment is very welcoming as well as all of the employees. justin goes above and beyond, and make sure that your vehicle is working efficiently before you walk out the door.",31,0.2333333333333333,0.861,Positive
Evans Toyota,help me when in need.,DealerRater,help me when in need.,5,0.0,0.4019,Positive
Evans Toyota,Outgoing and friendly staff. Strongly recommend buying from Evans Toyota. We will return.,DealerRater,outgoing and friendly staff. strongly recommend buying from evans toyota. we will return.,13,0.4041666666666667,0.8402,Positive
Evans Toyota,Premises are clean. Work is thorough. I was kept well informed throughout the process.,DealerRater,premises are clean. work is thorough. i was kept well informed throughout the process.,14,0.3666666666666667,0.5859,Positive
Evans Toyota,"car ready . The car was for our daughter, she was very happy",DealerRater,"car ready . the car was for our daughter, she was very happy",13,0.6,0.7574,Positive
Evans Toyota,"Karback gave me such s great deal, I couldn’t leave the dealership without our 2023 Camry!  Thank you Steven!  We are very happy!",DealerRater,"karback gave me such s great deal, i couldn’t leave the dealership without our 2023 camry! thank you steven! we are very happy!",23,0.6666666666666666,0.9056,Positive
Evans Toyota,They keep me informed every step of the way. They don't do anything without consulting you. Very pleased. Also very pleased with the shuttle driver. Very pleasant and personable.,DealerRater,they keep me informed every step of the way. they don't do anything without consulting you. very pleased. also very pleased with the shuttle driver. very pleasant and personable.,29,0.7511111111111112,0.8744,Positive
Evans Toyota,"He goes above and behind not only to do his job, but to make sure that the costumer is always taken care off. I went there to get a car and John helped with the process even though it was not his department. He is very respectful, professional and pleasant to talk to. 
Arjana Gllafce",DealerRater,"he goes above and behind not only to do his job, but to make sure that the costumer is always taken care off. i went there to get a car and john helped with the process even though it was not his department. he is very respectful, professional and pleasant to talk to. arjana gllafce",55,0.22619047619047622,0.9527,Positive
Evans Toyota,"Hybrid at Evans. Their service center is fast, courteous, friendly and always a pleasure to deal with.  There's never a need to stress about arranging service. I can always get my car in quickly and the shuttle is so convenient!",DealerRater,"hybrid at evans. their service center is fast, courteous, friendly and always a pleasure to deal with. there's never a need to stress about arranging service. i can always get my car in quickly and the shuttle is so convenient!",40,0.29833333333333334,0.8268,Positive
Evans Toyota,I particularly enjoyed the interactive progress of my vechicle via text.,DealerRater,i particularly enjoyed the interactive progress of my vechicle via text.,11,0.5,0.7501,Positive
Evans Toyota,service department. Each service advisor treats us with respect. I love that they provide video of our vehicle back in the service department. It shows commitment and concern for their customers.,DealerRater,service department. each service advisor treats us with respect. i love that they provide video of our vehicle back in the service department. it shows commitment and concern for their customers.,31,0.25,0.872,Positive
