dealer,review_text,source,clean_review,word_count,tb_polarity,vader_compound,sentiment
Cronin Toyota Nissan of Richmond,"Nissan of Richmond on Thursday 12/14/2023. We had been in contact via texting/email with Drew (a salesman) on a new 2023 Rav4 Hybrid Limited since Tuesday 12/12/23. We called the dealership on 12/14/23 in the morning and spoke with salesman Josh to confirm availability of the vehicle before we made the 2 hour and 15 minute drive from Madison, Indiana. Drew had the day off. Josh assured us the vehicle was available and he would have it sitting out front for us to test drive along with a 2024 Highlander Hybrid Limited. We arrived at ~ 12:10pm as Josh was pulling the last of the 2 cars around to the front of the dealership. As we walked in the front doors, another employee asked if they could help us. We told him that we had just driven from Madison to look at the 2 cars. He confirmed that he was aware we had driven so far and was expecting us. My wife and I drove the Highlander first ~ 5 miles with Josh riding with us. We wanted to drive a Highlander to make sure the Rav4 was what we wanted - the salesman was aware the Rav4 was the main vehicle we had come to purchase. Upon our return from test driving the Highlander, we went over to look at the Rav4. There were 2 customers sitting in the vehicle! Needless to say, the dealership sold them the vehicle while we waited at Josh's desk. The dealership should have told the other interested party that another couple had driven a long distance to decide on the Rav4 and they needed to give us the first opportunity to begin negotiating on the Rav4. Instead, we set at Josh's desk and got madder and madder as we watched the other people negotiating. We explained to Josh that this wasn't fair. He went to the managers desk to inform him of our thoughts and then just hung out at the desk while we just sit there and got angrier.
This wasn't fair to us whether we drove 200 miles round trip or not. That just added to the frustration we felt. We do not recommend this dealership. We were treated unfairly and they did not care. Again, we do not recommend this dealership.",DealerRater,"nissan of richmond on thursday 12/14/2023. we had been in contact via texting/email with drew (a salesman) on a new 2023 rav4 hybrid limited since tuesday 12/12/23. we called the dealership on 12/14/23 in the morning and spoke with salesman josh to confirm availability of the vehicle before we made the 2 hour and 15 minute drive from madison, indiana. drew had the day off. josh assured us the vehicle was available and he would have it sitting out front for us to test drive along with a 2024 highlander hybrid limited. we arrived at ~ 12:10pm as josh was pulling the last of the 2 cars around to the front of the dealership. as we walked in the front doors, another employee asked if they could help us. we told him that we had just driven from madison to look at the 2 cars. he confirmed that he was aware we had driven so far and was expecting us. my wife and i drove the highlander first ~ 5 miles with josh riding with us. we wanted to drive a highlander to make sure the rav4 was what we wanted - the salesman was aware the rav4 was the main vehicle we had come to purchase. upon our return from test driving the highlander, we went over to look at the rav4. there were 2 customers sitting in the vehicle! needless to say, the dealership sold them the vehicle while we waited at josh's desk. the dealership should have told the other interested party that another couple had driven a long distance to decide on the rav4 and they needed to give us the first opportunity to begin negotiating on the rav4. instead, we set at josh's desk and got madder and madder as we watched the other people negotiating. we explained to josh that this wasn't fair. he went to the managers desk to inform him of our thoughts and then just hung out at the desk while we just sit there and got angrier. this wasn't fair to us whether we drove 200 miles round trip or not. that just added to the frustration we felt. we do not recommend this dealership. we were treated unfairly and they did not care. again, we do not recommend this dealership.",381,0.12508362849271942,-0.7884,Negative
Cronin Toyota Nissan of Richmond,"Nissan of Richmond on Thursday 12/14/2023. We had been in contact via texting/email with Drew (a salesman) on a new 2023 Rav4 Hybrid Limited since Tuesday 12/12/23. We called the dealership on 12/14/23 in the morning and spoke with salesman Josh to confirm availability of the vehicle before we made the 2 hour and 15 minute drive from Madison, Indiana. Drew had the day off. Josh assured us the vehicle was available and he would have it sitting out front for us to test drive along with a 2024 Highlander Hybrid Limited. We arrived at ~ 12:10pm as Josh was pulling the last of the 2 cars around to the front of the dealership. As we walked in the front doors, another employee asked if they could help us. We told him that we had just driven from Madison to look at the 2 cars. He confirmed that he was aware we had driven so far and was expecting us. My wife and I drove the Highlander first ~ 5 miles with Josh riding with us. We wanted to drive a Highlander to make sure the Rav4 was what we wanted - the salesman was aware the Rav4 was the main vehicle we had come to purchase. Upon our return from test driving the Highlander, we went over to look at the Rav4. There were 2 customers sitting in the vehicle! Needless to say, the dealership sold them the vehicle while we waited at Josh's desk. The dealership should have told the other interested party that another couple had driven a long distance to decide on the Rav4 and they needed to give us the first opportunity to begin negotiating on the Rav4. Instead, we set at Josh's desk and got madder and madder as we watched the other people negotiating. We explained to Josh that this wasn't fair. He went to the managers desk to inform him of our thoughts and then just hung out at the desk while we just sit there and got angrier.
This wasn't fair to us whether we drove 200 miles round trip or not. That just added to the frustration we felt. We do not recommend this dealership. We were treated unfairly and they did not care. Again, we do not recommend this dealership.",DealerRater,"nissan of richmond on thursday 12/14/2023. we had been in contact via texting/email with drew (a salesman) on a new 2023 rav4 hybrid limited since tuesday 12/12/23. we called the dealership on 12/14/23 in the morning and spoke with salesman josh to confirm availability of the vehicle before we made the 2 hour and 15 minute drive from madison, indiana. drew had the day off. josh assured us the vehicle was available and he would have it sitting out front for us to test drive along with a 2024 highlander hybrid limited. we arrived at ~ 12:10pm as josh was pulling the last of the 2 cars around to the front of the dealership. as we walked in the front doors, another employee asked if they could help us. we told him that we had just driven from madison to look at the 2 cars. he confirmed that he was aware we had driven so far and was expecting us. my wife and i drove the highlander first ~ 5 miles with josh riding with us. we wanted to drive a highlander to make sure the rav4 was what we wanted - the salesman was aware the rav4 was the main vehicle we had come to purchase. upon our return from test driving the highlander, we went over to look at the rav4. there were 2 customers sitting in the vehicle! needless to say, the dealership sold them the vehicle while we waited at josh's desk. the dealership should have told the other interested party that another couple had driven a long distance to decide on the rav4 and they needed to give us the first opportunity to begin negotiating on the rav4. instead, we set at josh's desk and got madder and madder as we watched the other people negotiating. we explained to josh that this wasn't fair. he went to the managers desk to inform him of our thoughts and then just hung out at the desk while we just sit there and got angrier. this wasn't fair to us whether we drove 200 miles round trip or not. that just added to the frustration we felt. we do not recommend this dealership. we were treated unfairly and they did not care. again, we do not recommend this dealership.",381,0.12508362849271942,-0.7884,Negative
Cronin Toyota Nissan of Richmond,He is able to answer all of your questions or get you the needed information to answer it for you.  I would recommend him to anyone looking for a new vehicle as he will make the experience easy and pleasurable.,DealerRater,he is able to answer all of your questions or get you the needed information to answer it for you. i would recommend him to anyone looking for a new vehicle as he will make the experience easy and pleasurable.,40,0.3565656565656566,0.8316,Positive
Andy Mohr Toyota,Lots of excuses and stories. Little communication.  Don't return calls. After 8 weeks the car was repaired.,DealerRater,lots of excuses and stories. little communication. don't return calls. after 8 weeks the car was repaired.,17,-0.1875,0.0,Neutral
Andy Mohr Toyota,"Went for a service job scheduled my appointment a week in advance and called the day before to make sure everything was OK before going in. I dropped my car off speaking with service helper named Nerri.  Explained to me it was no problem and would take only 2 hours. He mentioned to me that they were apparently 6 cars behind.  I said no worries just call me when its ready. I waited 2 hours and got the call to be told they made a mistake. The part ordered for service was never ordered somehow even tho before the appointment it was checked in inventory and green lighted.  I demanded to speak to a manger, and was put on hold to be hung up on and then texted that they'll call me shortly.  As im on my way to retrieve my vehicle the manger tells me "" so we have this story "" , but this is no story and this is not a manger who is doing thier job.  As they crash out on me on the phone and ask me "" what do you want me to do here."" This shop is a joke , this was my second experience of using them in 6 months time. The first time was an oil change on my 2004 highlander. There was a 2025 grand highlander had the same thing done parked next to mine. As the owner drove out I watched 6 or more quarts of oil spill out the forgotten drain plug and watched them drive out and down the street.  Should have never came back but sadly I did. Stay away from this stealership and thier Unprofessional service station unless you want to pay thousands in repairs or have your vehicle held against you.",DealerRater,"went for a service job scheduled my appointment a week in advance and called the day before to make sure everything was ok before going in. i dropped my car off speaking with service helper named nerri. explained to me it was no problem and would take only 2 hours. he mentioned to me that they were apparently 6 cars behind. i said no worries just call me when its ready. i waited 2 hours and got the call to be told they made a mistake. the part ordered for service was never ordered somehow even tho before the appointment it was checked in inventory and green lighted. i demanded to speak to a manger, and was put on hold to be hung up on and then texted that they'll call me shortly. as im on my way to retrieve my vehicle the manger tells me "" so we have this story "" , but this is no story and this is not a manger who is doing thier job. as they crash out on me on the phone and ask me "" what do you want me to do here."" this shop is a joke , this was my second experience of using them in 6 months time. the first time was an oil change on my 2004 highlander. there was a 2025 grand highlander had the same thing done parked next to mine. as the owner drove out i watched 6 or more quarts of oil spill out the forgotten drain plug and watched them drive out and down the street. should have never came back but sadly i did. stay away from this stealership and thier unprofessional service station unless you want to pay thousands in repairs or have your vehicle held against you.",297,0.07320261437908497,-0.71,Negative
Andy Mohr Toyota,"I liked a car, and a sales representative named Jeff Velasquez offered a 2025 RAV 4 Limited for $38,000. I was still undecided about the deal. I finally had a day off yesterday, Veterans Day. I called and got confirmation that the price was still the same. I went in to test the car and wanted to trade in my car as part of the purchase. They offered a very low price for my trade-in until I showed them the report from CarMax. They raised the offer a bit and explained the tax implications before and after the trade. I was aware of how it worked. Then they raised the price further. What a rip-off. You don't want to waste your time with this sales representative or his manager, who tried to convince me to come in for a test drive and made me wait. It was a complete waste of time. Their customer service is very poor, and they blatantly BIG LIED to customers like me.",DealerRater,"i liked a car, and a sales representative named jeff velasquez offered a 2025 rav 4 limited for $38,000. i was still undecided about the deal. i finally had a day off yesterday, veterans day. i called and got confirmation that the price was still the same. i went in to test the car and wanted to trade in my car as part of the purchase. they offered a very low price for my trade-in until i showed them the report from carmax. they raised the offer a bit and explained the tax implications before and after the trade. i was aware of how it worked. then they raised the price further. what a rip-off. you don't want to waste your time with this sales representative or his manager, who tried to convince me to come in for a test drive and made me wait. it was a complete waste of time. their customer service is very poor, and they blatantly big lied to customers like me.",167,-0.03395604395604396,-0.6784,Negative
Andy Mohr Toyota,"nothing but issues. 

I thought a used KIA from the Andy Mohr Toyota location - it had outstanding service recalls on it. The AC was not functioning properly - They refused to fix it and honor the listed price on the vehicle. They “met me in the middle” and took about $700 off the price but would not inspect or diagnose the issue without me paying THOUSANDS more than the listed price. 

In desperate need of a vehicle, I agreed to that. I took my vehicle to a local KIA dealership where they fixed both recalls and gave me a full inspection of the car - Not only did the AC need over $1000 worth of work, the cabin air filter was filthy, the oil filter was barely attached and leaking, the drive belt needs replaced… I am just absolutely disgusted with the outcome of this vehicle. 

The salesman acted bored the entire time bc I wasn’t buying a brand new Toyota - He didn’t know anything about the vehicle. And the service department clearly isn’t willing to help. 

I love my KIA and bc of this will NEVER shop at an Andy Mohr location, nor will I ever buy a Toyota.",DealerRater,"nothing but issues. i thought a used kia from the andy mohr toyota location - it had outstanding service recalls on it. the ac was not functioning properly - they refused to fix it and honor the listed price on the vehicle. they “met me in the middle” and took about $700 off the price but would not inspect or diagnose the issue without me paying thousands more than the listed price. in desperate need of a vehicle, i agreed to that. i took my vehicle to a local kia dealership where they fixed both recalls and gave me a full inspection of the car - not only did the ac need over $1000 worth of work, the cabin air filter was filthy, the oil filter was barely attached and leaking, the drive belt needs replaced… i am just absolutely disgusted with the outcome of this vehicle. the salesman acted bored the entire time bc i wasn’t buying a brand new toyota - he didn’t know anything about the vehicle. and the service department clearly isn’t willing to help. i love my kia and bc of this will never shop at an andy mohr location, nor will i ever buy a toyota.",202,-0.005980861244019145,-0.6297,Negative
Andy Mohr Toyota,"without my knowledge. It wasn't until I arrived homwe and reviewed documents on a flashdrive given to me that I found out.
The car has myriad electrical problems, it needs brakes and it was filthy. It was purchased as-is but they disuaded me from getting a third-party inspection. They are thieving unscrupulous and scam with PNC Bank.
If you want to taken by all means Mohr Toyota will oblige you. See Nathan Horn, Billy Gamble, and Ryan Spearman for a raew deal myou will regret immediately.",DealerRater,"without my knowledge. it wasn't until i arrived homwe and reviewed documents on a flashdrive given to me that i found out. the car has myriad electrical problems, it needs brakes and it was filthy. it was purchased as-is but they disuaded me from getting a third-party inspection. they are thieving unscrupulous and scam with pnc bank. if you want to taken by all means mohr toyota will oblige you. see nathan horn, billy gamble, and ryan spearman for a raew deal myou will regret immediately.",86,-0.8,-0.8793,Negative
Andy Mohr Toyota,They are very nice and they do  right. My advisor waa great and the lady who assist me.,DealerRater,they are very nice and they do right. my advisor waa great and the lady who assist me.,18,0.621904761904762,0.8016,Positive
Andy Mohr Toyota,I told them I didn’t want their inspection because it takes and hour plus and they come back and tell you that you have $3000+ of bogus repairs that are needed.,DealerRater,i told them i didn’t want their inspection because it takes and hour plus and they come back and tell you that you have $3000+ of bogus repairs that are needed.,31,0.0,0.0772,Positive
Andy Mohr Toyota,"Florida and having a bad experience at another Toyota dealer here in Indianapolis.  They are professional, answer my questions and it’s easy to get an appointment",DealerRater,"florida and having a bad experience at another toyota dealer here in indianapolis. they are professional, answer my questions and it’s easy to get an appointment",26,-0.055555555555555504,-0.1531,Negative
Andy Mohr Toyota,and efficient manner. Highly recommend to all!,DealerRater,and efficient manner. highly recommend to all!,7,0.2,0.7082,Positive
Andy Mohr Toyota,Mohr in Avon. He has consistently listened to all our concerns and requests. He has never tried to “talk us into” vehicles we couldn’t afford or weren’t comfortable with. He has worked with the service department to get things corrected for us. And even went so far as to deliver vehicles to our house (over an hour away) when that service took a bit longer. Also want to compliment Monty in the Finance Department for making all that paperwork so easy to understand! This last purchase was my granddaughter’s first time purchasing a car and I was thankful it was a good experience for her and us!,DealerRater,mohr in avon. he has consistently listened to all our concerns and requests. he has never tried to “talk us into” vehicles we couldn’t afford or weren’t comfortable with. he has worked with the service department to get things corrected for us. and even went so far as to deliver vehicles to our house (over an hour away) when that service took a bit longer. also want to compliment monty in the finance department for making all that paperwork so easy to understand! this last purchase was my granddaughter’s first time purchasing a car and i was thankful it was a good experience for her and us!,107,0.3452380952380953,0.956,Positive
Andy Mohr Toyota,the negotiations were quick and simple.,DealerRater,the negotiations were quick and simple.,6,0.16666666666666666,0.0,Neutral
Andy Mohr Toyota,they didn't drive it to find what I was trying to explain was wrong with it. Finally they listened after I drove over and hour for the third time and fixed it but on my dime,DealerRater,they didn't drive it to find what i was trying to explain was wrong with it. finally they listened after i drove over and hour for the third time and fixed it but on my dime,36,-0.1,-0.2617,Negative
Andy Mohr Toyota,Mousa for helping and see you again just keep it like that:),DealerRater,mousa for helping and see you again just keep it like that:),12,0.5,0.5719,Positive
Andy Mohr Toyota,"!
I know that dealerships inflate the interest rates to make money, but disappointed in the lack of negotiations. I was reluctant to deal with Andy Mohr to begin with, but I contacted them in hopes of a fair deal and was ready to purchase. The dealership refused to negotiate even slightly on the price—despite the vehicle being clearly on the lot an extended period of time. What was even more frustrating was the financing process. I got approved, yet they offered me an interest rate that was higher than what I qualified. It felt like they were not interested in actually making a deal. Would not recommend to anyone looking to get a deal or transparent car-buying process.",DealerRater,"! i know that dealerships inflate the interest rates to make money, but disappointed in the lack of negotiations. i was reluctant to deal with andy mohr to begin with, but i contacted them in hopes of a fair deal and was ready to purchase. the dealership refused to negotiate even slightly on the price—despite the vehicle being clearly on the lot an extended period of time. what was even more frustrating was the financing process. i got approved, yet they offered me an interest rate that was higher than what i qualified. it felt like they were not interested in actually making a deal. would not recommend to anyone looking to get a deal or transparent car-buying process.",119,0.030833333333333324,0.6652,Positive
Andy Mohr Toyota,"asked for tire pressure check, cause had a low tire and light was on. When I picked up vehicle the light was still on and the tires were never rotated. I had to come back in for them to air tires and rotate. Now I am noticing the wipers were never even changed! I spent $250 for an oil change. I will never return to this location and I would advise anyone to be cautious on trusting this dealer.",DealerRater,"asked for tire pressure check, cause had a low tire and light was on. when i picked up vehicle the light was still on and the tires were never rotated. i had to come back in for them to air tires and rotate. now i am noticing the wipers were never even changed! i spent $250 for an oil change. i will never return to this location and i would advise anyone to be cautious on trusting this dealer.",79,0.14,-0.3164,Negative
Andy Mohr Toyota,"The vehicle I came in to test drive was not on the lot as they sell out quick as soon as they get inventory delivered. We hopped in a used model and went for a drive so I could get a feel for the car. The ride was great and I was certain I wanted to order one in a specific color. When we got back to the dealership, Andrew and the sales manager brought me information on a vehicle in transit from the factory. It wasn't the color I had wanted, but after some back and forth negotiations, they made me an offer I couldn't refuse. My first RAV4 ever and I am very happy with it. Thank you to the team at Andy Mohr Toyota for making this car purchase an easy decision! I look forward to doing business again in the future.",DealerRater,"the vehicle i came in to test drive was not on the lot as they sell out quick as soon as they get inventory delivered. we hopped in a used model and went for a drive so i could get a feel for the car. the ride was great and i was certain i wanted to order one in a specific color. when we got back to the dealership, andrew and the sales manager brought me information on a vehicle in transit from the factory. it wasn't the color i had wanted, but after some back and forth negotiations, they made me an offer i couldn't refuse. my first rav4 ever and i am very happy with it. thank you to the team at andy mohr toyota for making this car purchase an easy decision! i look forward to doing business again in the future.",145,0.31392857142857145,0.9602,Positive
Andy Mohr Toyota,"of car I wanted.  I saw the Crown from a distance and asked what kind of car that was.  His face lit up as he said, “that’s a crown and that may be just the car you are looking for.”  He was right!",DealerRater,"of car i wanted. i saw the crown from a distance and asked what kind of car that was. his face lit up as he said, “that’s a crown and that may be just the car you are looking for.” he was right!",43,0.47857142857142854,0.0,Neutral
Andy Mohr Toyota,"Called ahead to verify it was there, which we were told it was. Drove 30 minutes to get there and they said it was sold. There is no way it wasn’t sold before we got there. It took them over 24 hours to remove it from the website. Tried to give us options we weren’t even interested in.",DealerRater,"called ahead to verify it was there, which we were told it was. drove 30 minutes to get there and they said it was sold. there is no way it wasn’t sold before we got there. it took them over 24 hours to remove it from the website. tried to give us options we weren’t even interested in.",58,0.25,0.128,Positive
Andy Mohr Toyota,had the best salesman named luke got me the car i wanted and in my price!,DealerRater,had the best salesman named luke got me the car i wanted and in my price!,16,1.0,0.6696,Positive
Andy Mohr Toyota,Very courteous. Car was done well. Happy with results,DealerRater,very courteous. car was done well. happy with results,9,0.79,0.8553,Positive
