dealer,review_text,source,clean_review,word_count,tb_polarity,vader_compound,sentiment
Kokomo Auto World,Adam and Dustin was very helpful through the whole process of purchasing my newer vehicle. Christy was very useful by keeping me posted of the availability of the Honda Civic that I eventually purchased. Thanks to all. I would recommend Kokomo Auto World to other's when they are needing a car or truck. I traded my 1993 Ford Ranger in that I originally bought brand new from Kokomo Auto World when they were a Ford Dealer,DealerRater,adam and dustin was very helpful through the whole process of purchasing my newer vehicle. christy was very useful by keeping me posted of the availability of the honda civic that i eventually purchased. thanks to all. i would recommend kokomo auto world to other's when they are needing a car or truck. i traded my 1993 ford ranger in that i originally bought brand new from kokomo auto world when they were a ford dealer,76,0.19662337662337664,0.893,Positive
Kokomo Auto World,They were awesome they took the time and really worked with me to get the car I wanted. I was very happy with the customer service i received,DealerRater,they were awesome they took the time and really worked with me to get the car i wanted. i was very happy with the customer service i received,28,0.7333333333333334,0.8439,Positive
Kokomo Auto World,Adam Richardson was extremely helpful and accommodating of my hectic schedule. He got me taken care of from test drive to completion of purchase extremely quickly. Adam made sure all details were taken care of before I ever pulled away. Adam and Dustin made this process as efficient and easy as possible with little to no stress involved. My family will continue making our purchases with Adam and Kokomo Auto World every time.,DealerRater,adam richardson was extremely helpful and accommodating of my hectic schedule. he got me taken care of from test drive to completion of purchase extremely quickly. adam made sure all details were taken care of before i ever pulled away. adam and dustin made this process as efficient and easy as possible with little to no stress involved. my family will continue making our purchases with adam and kokomo auto world every time.,73,0.15902777777777777,0.9537,Positive
Kokomo Auto World,"Adam Richardson is a top notch salesman who you can easily talk to.  He understood what I wanted and where I needed to be and we got there.  He even had to locate the Honda Civic SI that i wanted.  Took less than a week, and im now driving the exact car i wanted!  Thank you Adam and everyone at the Kokomo Auto World dealership!",DealerRater,"adam richardson is a top notch salesman who you can easily talk to. he understood what i wanted and where i needed to be and we got there. he even had to locate the honda civic si that i wanted. took less than a week, and im now driving the exact car i wanted! thank you adam and everyone at the kokomo auto world dealership!",65,0.28932291666666665,0.7418,Positive
Kokomo Auto World,"Wasn't too pushing. We got to take our time and check things out. Worked with me o. Financing. They even stayed over after hours a bit so my wife could make it there after work to sign paperwork.
Adam said he was gonna work for us and that's just what he did.",DealerRater,wasn't too pushing. we got to take our time and check things out. worked with me o. financing. they even stayed over after hours a bit so my wife could make it there after work to sign paperwork. adam said he was gonna work for us and that's just what he did.,52,0.0,0.0,Neutral
Kokomo Auto World,"We purchased a new CRV a few months ago, and then we had another need for a used vehicle. Our salesman from our new CRV was Adam and we appreciated his service, so we contacted him in regards to a need for a good used vehicle. We did research online and then collaborated with Adam. We hope our used CRV is long lived. We look forward to years of service for both CRVs! Dustin was open and frank when discussing the finances and extended services. We appreciated his professionalism.",DealerRater,"we purchased a new crv a few months ago, and then we had another need for a used vehicle. our salesman from our new crv was adam and we appreciated his service, so we contacted him in regards to a need for a good used vehicle. we did research online and then collaborated with adam. we hope our used crv is long lived. we look forward to years of service for both crvs! dustin was open and frank when discussing the finances and extended services. we appreciated his professionalism.",89,0.13877840909090908,0.9134,Positive
Kokomo Auto World,"We had been looking for a Specific style and price of a Toyota 4Runner for quite some time, Adam R. Helped us find exactly what we were looking for. We took the 4Runner on a extended test drive and loved it. We brought it back and talked numbers and were please to make the purchase!  No nonsense price with very helpful staff. They went above and beyond Cleaning the 4Runner to make it look like the day it was built. Alec D. in the finance office helped us find the perfect lending group, and got us approved!  It was over all a great experience, beautiful building, and friendly staff.  A+ work guys!",DealerRater,"we had been looking for a specific style and price of a toyota 4runner for quite some time, adam r. helped us find exactly what we were looking for. we took the 4runner on a extended test drive and loved it. we brought it back and talked numbers and were please to make the purchase! no nonsense price with very helpful staff. they went above and beyond cleaning the 4runner to make it look like the day it was built. alec d. in the finance office helped us find the perfect lending group, and got us approved! it was over all a great experience, beautiful building, and friendly staff. a+ work guys!",112,0.42687500000000006,0.9857,Positive
Kokomo Auto World,"All I can say is keep up the good work Adam Richardson. Thanks for all your help.  GALAR MCGEE. 
And I will be glad to send a friend.",DealerRater,all i can say is keep up the good work adam richardson. thanks for all your help. galar mcgee. and i will be glad to send a friend.,28,0.4666666666666666,0.9287,Positive
Kokomo Auto World,we had great customer service from the minute we walked in and all through the process.we are happy customers and we look forward to buying another car there. the place is clean. thank you kokomo auto world for your professionalism.,DealerRater,we had great customer service from the minute we walked in and all through the process.we are happy customers and we look forward to buying another car there. the place is clean. thank you kokomo auto world for your professionalism.,40,0.6555555555555556,0.9186,Positive
Kokomo Auto World,"Adam and Alec were great and made everything so easy for me! Also, Adam made me feel so comfortable in my decision. My first newly used car ever! So happy 😊",DealerRater,"adam and alec were great and made everything so easy for me! also, adam made me feel so comfortable in my decision. my first newly used car ever! so happy 😊",31,0.4936868686868687,0.9769,Positive
Kokomo Auto World,Adam and Greg were awesome to work with.  We had a great experience and didn’t feel like we were just a number.   We bought our new Honda Pilot there.   We are totally happy with the car and our experience at Kokomo Auto World.  Thanks Adam and Greg.,DealerRater,adam and greg were awesome to work with. we had a great experience and didn’t feel like we were just a number. we bought our new honda pilot there. we are totally happy with the car and our experience at kokomo auto world. thanks adam and greg.,47,0.5872727272727273,0.9577,Positive
Kokomo Auto World,Everyone was friendly. We drove 3 cars before deciding. The paperwork was painless and we left with the car we wanted. First car purchased at this dealership and we would come back again.,DealerRater,everyone was friendly. we drove 3 cars before deciding. the paperwork was painless and we left with the car we wanted. first car purchased at this dealership and we would come back again.,33,0.15625,0.6597,Positive
Kokomo Auto World,No pressure. Sales and financial people a pleasure to work with. Car inventory was excellent. The dealership was was people friendly and all staff very friendly.,DealerRater,no pressure. sales and financial people a pleasure to work with. car inventory was excellent. the dealership was was people friendly and all staff very friendly.,26,0.465625,0.9431,Positive
Kokomo Auto World,"Adam Street was who worked with me at Kokomo Auto World. The service was excellent and super friendly. He didn't try to push me or over glorify any aspects of the vehicle
Straight and to the point how I like it.
They worked with me to make everything as easy as possible
Thanks guys",DealerRater,adam street was who worked with me at kokomo auto world. the service was excellent and super friendly. he didn't try to push me or over glorify any aspects of the vehicle straight and to the point how i like it. they worked with me to make everything as easy as possible thanks guys,54,0.36309523809523814,0.9741,Positive
Kokomo Auto World,"Adam was great, and I really liked how forthcoming he was. Didn't feel like I was buying from a salesman, and when I asked a question, I got an honest answer. Only hiccup was in the finance department, and when I waved all the upgrades, the guy helping me become very short/cold/rude (he said that it was ""statistically smarter"" to get the upgrades, which is a roundabout way of calling me dumb). But for the price, and for dealing with Adam, I'd say it was worth it. Alec could be less transparent after losing out on a commision though. Greg was really nice and accommodating to my wife and kids though. Seems like a good manager (with a good sense of fair prices).",DealerRater,"adam was great, and i really liked how forthcoming he was. didn't feel like i was buying from a salesman, and when i asked a question, i got an honest answer. only hiccup was in the finance department, and when i waved all the upgrades, the guy helping me become very short/cold/rude (he said that it was ""statistically smarter"" to get the upgrades, which is a roundabout way of calling me dumb). but for the price, and for dealing with adam, i'd say it was worth it. alec could be less transparent after losing out on a commision though. greg was really nice and accommodating to my wife and kids though. seems like a good manager (with a good sense of fair prices).",123,0.38819444444444445,0.972,Positive
Kokomo Auto World,"What started out as a hectic decision making and all the choices, was soothed out by Leah, who kept on top of the play by play changes.  She had it all come together in the end.",DealerRater,"what started out as a hectic decision making and all the choices, was soothed out by leah, who kept on top of the play by play changes. she had it all come together in the end.",36,0.5,0.7269,Positive
Kokomo Auto World,"Found vehicle on Autotrader. We live in Indianapolis and when I contacted the dealer through Autotrader, they responded within 30 min. There were no photos because they just received the vehicle. Christy took pictures and sent them to me and connected me with Adam to discuss the vehicle. Drove up from Indy the next day and were welcomed at the door. Adam did a great job explaining their pricing and went with us on the test drive. Adam worked with us on the trade and we got the price we were looking for. One of the best car buying experiences I have had. Alec got us through financing quickly and Greg from the management office made sure we were comfortable why we were waiting. Will definitely be looking at Kokomo Auto World for our next purchase!",DealerRater,"found vehicle on autotrader. we live in indianapolis and when i contacted the dealer through autotrader, they responded within 30 min. there were no photos because they just received the vehicle. christy took pictures and sent them to me and connected me with adam to discuss the vehicle. drove up from indy the next day and were welcomed at the door. adam did a great job explaining their pricing and went with us on the test drive. adam worked with us on the trade and we got the price we were looking for. one of the best car buying experiences i have had. alec got us through financing quickly and greg from the management office made sure we were comfortable why we were waiting. will definitely be looking at kokomo auto world for our next purchase!",136,0.3521885521885522,0.9523,Positive
Kokomo Auto World,"We came in to look at cars, walked out with a deal we couldn’t pass up! Great service, great people and we love our new Camary",DealerRater,"we came in to look at cars, walked out with a deal we couldn’t pass up! great service, great people and we love our new camary",26,0.5590909090909091,0.9286,Positive
Kokomo Auto World,We appreciated all of the prep work and patience the KAW Team put into our visit. Adam Street and the Sales team were excellent. Alec in Finance were perfect. We appreciated the understanding that we wanted to buy out our Lease. No strongarming needed. Just a great experience. Thank you for everything.,DealerRater,we appreciated all of the prep work and patience the kaw team put into our visit. adam street and the sales team were excellent. alec in finance were perfect. we appreciated the understanding that we wanted to buy out our lease. no strongarming needed. just a great experience. thank you for everything.,52,0.64,0.9607,Positive
Kokomo Auto World,"After being hit by a drunk driver I had to buy a new vehicle within a very short amount of time. I finally found the SUV I wanted, within my price range, and in great condition so I drove 45 minutes to Kokomo Auto Workd.  My 2012 Terrain was in amazing condition, low mileage, detailed inside and out, and everything I wanted. The dealership was fine, Cain, my salesman, was great, he was young but willing to find any answers he didn’t have. Four days after owning my SUV I noticed the chrome paint on the wheels starting to bubble and chip away. I took my Terrain to my local GMC dealership to ask if the alloy wheels where faulty and they laughed. They all laughed at me and said “Sweety, who ever sold you this car spray painted the wheels to look fancy! Take it back!” When I contacted Kokomo Auto World they denied ever painting the wheels but offer to charge me $160 to sand down the chipping paint off for me! I’m a single mom working 3 jobs and they took advantage of me.",DealerRater,"after being hit by a drunk driver i had to buy a new vehicle within a very short amount of time. i finally found the suv i wanted, within my price range, and in great condition so i drove 45 minutes to kokomo auto workd. my 2012 terrain was in amazing condition, low mileage, detailed inside and out, and everything i wanted. the dealership was fine, cain, my salesman, was great, he was young but willing to find any answers he didn’t have. four days after owning my suv i noticed the chrome paint on the wheels starting to bubble and chip away. i took my terrain to my local gmc dealership to ask if the alloy wheels where faulty and they laughed. they all laughed at me and said “sweety, who ever sold you this car spray painted the wheels to look fancy! take it back!” when i contacted kokomo auto world they denied ever painting the wheels but offer to charge me $160 to sand down the chipping paint off for me! i’m a single mom working 3 jobs and they took advantage of me.",187,0.2269556466924888,0.8814,Positive
Kokomo Auto World,Adam  and alec made sure we got the best service and was so helpful and we had a great experience i will definitely refer a friend,DealerRater,adam and alec made sure we got the best service and was so helpful and we had a great experience i will definitely refer a friend,26,0.575,0.9644,Positive
Kokomo Auto World,I came in with a Jeep that had served its purpose. But was in need of something newer with fewer miles. And Adam and the fellas came through with the right car and price range I was looking for.,DealerRater,i came in with a jeep that had served its purpose. but was in need of something newer with fewer miles. and adam and the fellas came through with the right car and price range i was looking for.,39,0.2857142857142857,0.0,Neutral
Kokomo Auto World,"Everyone in the Dealership was Great to work with,the explained every step of the process to Us.Adam Street was very helpful and took me around and introduced me to everyone involved.It was a Class operation from start to finish. Thanks to Everyone !!",DealerRater,"everyone in the dealership was great to work with,the explained every step of the process to us.adam street was very helpful and took me around and introduced me to everyone involved.it was a class operation from start to finish. thanks to everyone !!",43,0.4375,0.8928,Positive
Royal South Toyota,"are trying to rip people off. 
They charged me $160 only for an oil change",DealerRater,are trying to rip people off. they charged me $160 only for an oil change,15,0.0,-0.2023,Negative
Royal South Toyota,"an appointment for a RECALL about the vehicles battery on her 2017 RAV4. She had to pay $39.?? for the labor, and when she questioned that, she was rudely spoke to by the service advisor stating “ there’s just no pleasing you “ I was a service writer for over 15 years with several classes and awards, and I never heard of charging a customer for anything that pertains to a recall, because that is all figured in on the billing warranty flat rate that the dealership sends to the manufacturer for their reimbursement! So my question is when did it change that a customer pays for labor for a recall?",DealerRater,"an appointment for a recall about the vehicles battery on her 2017 rav4. she had to pay $39.?? for the labor, and when she questioned that, she was rudely spoke to by the service advisor stating “ there’s just no pleasing you “ i was a service writer for over 15 years with several classes and awards, and i never heard of charging a customer for anything that pertains to a recall, because that is all figured in on the billing warranty flat rate that the dealership sends to the manufacturer for their reimbursement! so my question is when did it change that a customer pays for labor for a recall?",111,-0.11041666666666666,-0.6816,Negative
Royal South Toyota,"Zach was pleasant and very helpful during the purchase process. He also took a lot of time in the car with me after the “buy” , explaining all the features of the car which were quite new to me as my trade in was 10 years old.",DealerRater,"zach was pleasant and very helpful during the purchase process. he also took a lot of time in the car with me after the “buy” , explaining all the features of the car which were quite new to me as my trade in was 10 years old.",47,0.2924242424242425,0.7501,Positive
Royal South Toyota,"They made unnecessary, botched repairs on my car. Three visits and THOUSANDS of dollars later, my car has the same problem/trouble code it did when I first brought it in. The repairs were carelessly done every time (not reattaching the glovebox, gasoline leaking from the engine, forgetting to tighten bolts) but most importantly, they failed to fix the issue. I paid for separate repairs as the story changed, none of which fixed my car. When I lost confidence and refused a fourth visit for the same trouble code, they would not give me even a partial refund and claimed the repairs were exploratory. This is a classic example of how women are taken advantage of and targeted by this industry. I was told twice the repairs would fix my car, and I believed them. In the end I was overcharged and forced into unnecessary and sloppy repairs, with absolutely nothing to show for it. I am reporting this business.",DealerRater,"they made unnecessary, botched repairs on my car. three visits and thousands of dollars later, my car has the same problem/trouble code it did when i first brought it in. the repairs were carelessly done every time (not reattaching the glovebox, gasoline leaking from the engine, forgetting to tighten bolts) but most importantly, they failed to fix the issue. i paid for separate repairs as the story changed, none of which fixed my car. when i lost confidence and refused a fourth visit for the same trouble code, they would not give me even a partial refund and claimed the repairs were exploratory. this is a classic example of how women are taken advantage of and targeted by this industry. i was told twice the repairs would fix my car, and i believed them. in the end i was overcharged and forced into unnecessary and sloppy repairs, with absolutely nothing to show for it. i am reporting this business.",159,-0.06666666666666668,-0.8521,Negative
Royal South Toyota,"maintenance. Beforehand I checked fluid levels and marked my tires to make sure they got rotated as I've been burned in the past at other auto shops. When they were finished, I was given a several page readout of everything that was performed. My wiper fluid was still almost empty and my tires had not been rotated as stated they were. I went back in and explained to a service dept man up front what I found and stated how can I trust that all the other items on the checklist were even done. I told him I want another tech to redo the entire checklist. Afterward, he came back and said that he had the service manager redo it. The tires were rotated this time. However, the lugnuts are on way too tight that I would be unable to change a tire if I get a flat, I smell a burning smell each day that I drive it and it has been over 3 weeks since that appointment, and some settings on my vehicle have been reset including a trip A mileage that I am unable to reset and get the total mileage back on the screen. Idk if the battery was unhooked at the appointment causing this to happen or if there had been some sort of software update. Regardless, Idk why still having a burning smell after over 3 weeks and I cannot trust to take it back there again if I was lied to by the original tech about simple checklist items being done. It's not a free new vehicle ToyotaCare maintenance 2 yrs or 25,000 mile. It's paid for in the price of buying the vehicle. I didn't pay to be lied to. And I'm sure Toyota wouldn't appreciate it as I'm sure they compensate dealerships participating in this program.",DealerRater,"maintenance. beforehand i checked fluid levels and marked my tires to make sure they got rotated as i've been burned in the past at other auto shops. when they were finished, i was given a several page readout of everything that was performed. my wiper fluid was still almost empty and my tires had not been rotated as stated they were. i went back in and explained to a service dept man up front what i found and stated how can i trust that all the other items on the checklist were even done. i told him i want another tech to redo the entire checklist. afterward, he came back and said that he had the service manager redo it. the tires were rotated this time. however, the lugnuts are on way too tight that i would be unable to change a tire if i get a flat, i smell a burning smell each day that i drive it and it has been over 3 weeks since that appointment, and some settings on my vehicle have been reset including a trip a mileage that i am unable to reset and get the total mileage back on the screen. idk if the battery was unhooked at the appointment causing this to happen or if there had been some sort of software update. regardless, idk why still having a burning smell after over 3 weeks and i cannot trust to take it back there again if i was lied to by the original tech about simple checklist items being done. it's not a free new vehicle toyotacare maintenance 2 yrs or 25,000 mile. it's paid for in the price of buying the vehicle. i didn't pay to be lied to. and i'm sure toyota wouldn't appreciate it as i'm sure they compensate dealerships participating in this program.",305,0.004311688311688306,-0.267,Negative
Royal South Toyota,"and milage. I found what I was looking for and from the beginning to the end Zack was extreemly helpful. He went to bat for me to get the deal I needed to make. He kept me informed during the process. Believe me, Zack worked for his pay. Everyone we worked with at the dealership was very friendly and helpful.",DealerRater,"and milage. i found what i was looking for and from the beginning to the end zack was extreemly helpful. he went to bat for me to get the deal i needed to make. he kept me informed during the process. believe me, zack worked for his pay. everyone we worked with at the dealership was very friendly and helpful.",60,0.48750000000000004,0.8384,Positive
Royal South Toyota,"wonderful experience buying a used car at Royal South Toyota. Zach Bird was informative, honest and patient as I made my choice. They were willing to negotiate and kept me informed during the entire process as they helped with financing and keeping me within my budget.  I can definitely  recommend them and Zach. I’ll be having my new to me car serviced at this location as well. Thanks!",DealerRater,"wonderful experience buying a used car at royal south toyota. zach bird was informative, honest and patient as i made my choice. they were willing to negotiate and kept me informed during the entire process as they helped with financing and keeping me within my budget. i can definitely recommend them and zach. i’ll be having my new to me car serviced at this location as well. thanks!",68,0.3194805194805195,0.9476,Positive
