dealer,review_text,source,clean_review,word_count,tb_polarity,vader_compound,sentiment
Ed Martin Toyota,"and James Schubert!
You made buying our Toyota Highlander so Easy!! Ed Martin Toyota definitely treats you like family! Awesome People!!",DealerRater,and james schubert! you made buying our toyota highlander so easy!! ed martin toyota definitely treats you like family! awesome people!!,21,0.5590277777777778,0.935,Positive
Ed Martin Toyota,way through the process of me buying my new vehicle. He was easy to work with and very professional!,DealerRater,way through the process of me buying my new vehicle. he was easy to work with and very professional!,19,0.24406565656565657,0.4926,Positive
Ed Martin Toyota,He was knowledgeable and he made the process of buying a car easy. If I need another car I will specifically ask for Michael again.,DealerRater,he was knowledgeable and he made the process of buying a car easy. if i need another car i will specifically ask for michael again.,25,0.43333333333333335,0.4404,Positive
Ed Martin Toyota,"He was eligible to help us get where we needed to be for a monthly payment and was very communicative without being pushy. We did not expect to go in and buy a car that day, but everything aligned correctly, and we walked away happy.",DealerRater,"he was eligible to help us get where we needed to be for a monthly payment and was very communicative without being pushy. we did not expect to go in and buy a car that day, but everything aligned correctly, and we walked away happy.",45,0.5,0.8078,Positive
Ed Martin Toyota,"From the moment we walked into the dealership to the finance process, it was wonderful. Mike went up and beyond to help us and he even stayed late for us. We had to order our vehicle so it took about 6 weeks for it to come in. He kept us updated along the way without us even reaching out for updates. I would highly recommend Ed Martin Toyota. The other sales people were nice to use when we walked around but we worked with Mike and we were very happy with our experience.",DealerRater,"from the moment we walked into the dealership to the finance process, it was wonderful. mike went up and beyond to help us and he even stayed late for us. we had to order our vehicle so it took about 6 weeks for it to come in. he kept us updated along the way without us even reaching out for updates. i would highly recommend ed martin toyota. the other sales people were nice to use when we walked around but we worked with mike and we were very happy with our experience.",93,0.38916666666666666,0.904,Positive
Ed Martin Toyota,"They did an awesome job providing regular maintenance service before selling the vehicle! Also, dog friendly dealerships are always a better place to be!",DealerRater,"they did an awesome job providing regular maintenance service before selling the vehicle! also, dog friendly dealerships are always a better place to be!",24,0.5,0.8953,Positive
Ed Martin Toyota,Will definitely buy from Ben again. Very happy with everything.,DealerRater,will definitely buy from ben again. very happy with everything.,10,0.5,0.7713,Positive
Ed Martin Toyota,Team. They communicated very well throughout the whole process and made sure to answer every one of my questions. Highly recommend this team.,DealerRater,team. they communicated very well throughout the whole process and made sure to answer every one of my questions. highly recommend this team.,23,0.265,0.7569,Positive
Ed Martin Toyota,"He was polite, patient, HONEST and very knowledgeable.  We ran into a few issues, Mike and the dealership bent over backwards to work with us, and we left with a great deal, Mike was by far the best car salesmen I have ever worked with in the last 40 years.  I would again drive the 100+ plus miles to purchase another car from him and the dealership. Thanks again",DealerRater,"he was polite, patient, honest and very knowledgeable. we ran into a few issues, mike and the dealership bent over backwards to work with us, and we left with a great deal, mike was by far the best car salesmen i have ever worked with in the last 40 years. i would again drive the 100+ plus miles to purchase another car from him and the dealership. thanks again",69,0.30000000000000004,0.9382,Positive
Ed Martin Toyota,questions! Very knowledgable and kind. Highly recommend!,DealerRater,questions! very knowledgable and kind. highly recommend!,7,0.3333333333333333,0.793,Positive
Ed Martin Toyota,Felt like Ed Martin tried hard to keep my business. Never liked car shopping but it was a better experience than I've had in the past at other dealerships.,DealerRater,felt like ed martin tried hard to keep my business. never liked car shopping but it was a better experience than i've had in the past at other dealerships.,29,-0.09333333333333334,0.5767,Positive
Ed Martin Toyota,"shuggs, Eric the General Manager & I honestly forget the very nice lady in finance’s name but they all had very great attitudes. There are a few things that were iffy feeling at first but in the end it was an overall great experience & we got to go home with my new car! Thanks again y’all!!",DealerRater,"shuggs, eric the general manager & i honestly forget the very nice lady in finance’s name but they all had very great attitudes. there are a few things that were iffy feeling at first but in the end it was an overall great experience & we got to go home with my new car! thanks again y’all!!",57,0.37629545454545454,0.9713,Positive
Ed Martin Toyota,end. I would not hesitate to buy again from Ed Martin Toyota should the opportunity arise.,DealerRater,end. i would not hesitate to buy again from ed martin toyota should the opportunity arise.,16,0.0,0.5594,Positive
Ed Martin Toyota,and could demonstrate the features of the used car I was interested in. I am impressed!,DealerRater,and could demonstrate the features of the used car i was interested in. i am impressed!,16,0.625,0.7263,Positive
Ed Martin Toyota,"They were patient with me and, as I considered all the options, asked questions and ran independent checks. I was able to get all the service records and recorded information on the used car I ended up buying, and I had it independently inspected.
Kyle was very helpful. I found him transparent and clear about the purchase process and the car that I was looking at. Without him, my process would have looked very different, and I may not have been able to find a good car at my price point.",DealerRater,"they were patient with me and, as i considered all the options, asked questions and ran independent checks. i was able to get all the service records and recorded information on the used car i ended up buying, and i had it independently inspected. kyle was very helpful. i found him transparent and clear about the purchase process and the car that i was looking at. without him, my process would have looked very different, and i may not have been able to find a good car at my price point.",91,0.24999999999999997,0.8221,Positive
Ed Martin Toyota,and Ed Martin Toyota. Process was simple and easy; they even sent someone to pick me up from the airport. Would recommend!,DealerRater,and ed martin toyota. process was simple and easy; they even sent someone to pick me up from the airport. would recommend!,22,0.27083333333333337,0.69,Positive
Ed Martin Toyota,"He made the whole process simple and low-stress. What really stood out was how genuinely friendly and down-to-earth he was. It felt less like a sales pitch and more like having someone in your corner helping you find the right fit. Overall, just a really smooth, easy experience.",DealerRater,"he made the whole process simple and low-stress. what really stood out was how genuinely friendly and down-to-earth he was. it felt less like a sales pitch and more like having someone in your corner helping you find the right fit. overall, just a really smooth, easy experience.",48,0.23885281385281384,0.9334,Positive
Ed Martin Toyota,"level of reliability that gained our confidence. 
  Joshua was friendly and efficient and manifested a degree of personal interest sufficient to accomplished the routine work with a minimum of tedium.",DealerRater,level of reliability that gained our confidence. joshua was friendly and efficient and manifested a degree of personal interest sufficient to accomplished the routine work with a minimum of tedium.,30,0.19166666666666665,0.9501,Positive
Ed Martin Toyota,work with. Made our whole purchase smooth.,DealerRater,work with. made our whole purchase smooth.,7,0.30000000000000004,0.0,Neutral
Ed Martin Toyota,Only negative was having to ask for assistance since no one approached me.,DealerRater,only negative was having to ask for assistance since no one approached me.,13,-0.15,-0.7096,Negative
Ed Martin Toyota,He helped facilitate an amazing deal on my Rav 4 and was willing to work with me on getting the best deal.,DealerRater,he helped facilitate an amazing deal on my rav 4 and was willing to work with me on getting the best deal.,22,0.6166666666666667,0.8402,Positive
Ed Martin Toyota,"I did know the vehicle I was interested in, and the team made the experience enjoyable.  I appreciated Jay Bechara sharing his expertise with the Land Cruiser, and ensuring I was set up for success.  He walked me through all the options as we closed the deal.  I will definitely refer friends and family based on the experience.",DealerRater,"i did know the vehicle i was interested in, and the team made the experience enjoyable. i appreciated jay bechara sharing his expertise with the land cruiser, and ensuring i was set up for success. he walked me through all the options as we closed the deal. i will definitely refer friends and family based on the experience.",58,0.19166666666666665,0.9694,Positive
Ed Martin Toyota,"communicative, well versed in technical details, accommodating, and follow through was precise and timely.",DealerRater,"communicative, well versed in technical details, accommodating, and follow through was precise and timely.",14,0.2,0.2732,Positive
Ed Martin Toyota,"during his portion of the process. He was easy to talk to, didn't try and hide anything or make things complicated, and indeed was a big help in keeping me feeling good and like I understood what was happening despite it being my first time at a dealership and my first time buying a car! Thank you Ed!",DealerRater,"during his portion of the process. he was easy to talk to, didn't try and hide anything or make things complicated, and indeed was a big help in keeping me feeling good and like i understood what was happening despite it being my first time at a dealership and my first time buying a car! thank you ed!",58,0.21232638888888888,0.9337,Positive
Ed Martin Toyota,"Katrina did a wonderful job matching a vehicle with our needs. Again, wonderful experience all the way atound!",DealerRater,"katrina did a wonderful job matching a vehicle with our needs. again, wonderful experience all the way atound!",18,1.0,0.8268,Positive
Ed Martin Toyota,We wanted to buy it on memorial day. The other Toyota dealers were closed. I called Ed Martin and spoke to Michael Ball. We made an appointment. Michael is very friendly and not pushy about selling anything. We ended up buying a Toyota rav4 hybrid xle. The whole experience was handled well by Michael the team. We needed a second car and called Michael and he helped us find the right car at a reasonable price. I appreciate Ed Martin and Michael Ball for helping us with an awesome experience. I would recommend Michael Ball for any vehicle you would need. Top notch service and great price!,DealerRater,we wanted to buy it on memorial day. the other toyota dealers were closed. i called ed martin and spoke to michael ball. we made an appointment. michael is very friendly and not pushy about selling anything. we ended up buying a toyota rav4 hybrid xle. the whole experience was handled well by michael the team. we needed a second car and called michael and he helped us find the right car at a reasonable price. i appreciate ed martin and michael ball for helping us with an awesome experience. i would recommend michael ball for any vehicle you would need. top notch service and great price!,107,0.34482142857142856,0.9723,Positive
Ed Martin Toyota,John good pastor was a great help in getting me out of my old ride and into a new one at a fair rate.,DealerRater,john good pastor was a great help in getting me out of my old ride and into a new one at a fair rate.,24,0.4872727272727273,0.9001,Positive
Ed Martin Toyota,Martin Toyota.  Specifically Michael Ball took great care of my wife and I while looking for the vehicle and Bryan with the Finance department was great as well. Highly recommend this dealership!,DealerRater,martin toyota. specifically michael ball took great care of my wife and i while looking for the vehicle and bryan with the finance department was great as well. highly recommend this dealership!,32,0.6,0.9484,Positive
Ed Martin Toyota,"car. He was excellent to work with. The finance person made it a breeze and explained everything well. 
Thanks Erick ( dealer manager ) for the great team",DealerRater,car. he was excellent to work with. the finance person made it a breeze and explained everything well. thanks erick ( dealer manager ) for the great team,28,0.6666666666666666,0.9153,Positive
Ed Martin Toyota,I will be sure to buy my next vehicle from him!,DealerRater,i will be sure to buy my next vehicle from him!,11,0.25,0.3802,Positive
Ed Martin Toyota,Nice showroom and lot. Fast service when purchasing a new vehicle,DealerRater,nice showroom and lot. fast service when purchasing a new vehicle,11,0.31212121212121213,0.4215,Positive
Ed Martin Toyota,"He is awesome ! He helped me with New Car ! He is knowledgeable gave me great advice and deals! I will recommend Michael from ED Martin Toyota Noblesville,IN",DealerRater,"he is awesome ! he helped me with new car ! he is knowledgeable gave me great advice and deals! i will recommend michael from ed martin toyota noblesville,in",29,0.7234848484848485,0.9114,Positive
Ed Martin Toyota,with. Thank you again Tom!,DealerRater,with. thank you again tom!,5,0.0,0.4199,Positive
Ed Martin Toyota,website. I emailed them and Evan reached out to me 5 minutes later. One day later Evan got me in my new Encore! Very pleased with the service I received.,DealerRater,website. i emailed them and evan reached out to me 5 minutes later. one day later evan got me in my new encore! very pleased with the service i received.,30,0.20511363636363636,0.5974,Positive
Ed Martin Toyota,"My salesperson, Thankful, fit us in same day on a very busy Saturday last minute and got me exactly what i was looking for in my budget.",DealerRater,"my salesperson, thankful, fit us in same day on a very busy saturday last minute and got me exactly what i was looking for in my budget.",27,0.156,0.7351,Positive
Ed Martin Toyota,find what I was looking for.,DealerRater,find what i was looking for.,6,0.0,0.0,Neutral
Ed Martin Toyota,experience a pleasure. The negotiations were fair & we left feeling like he made a good deal on his first car.,DealerRater,experience a pleasure. the negotiations were fair & we left feeling like he made a good deal on his first car.,21,0.4125,0.8979,Positive
Ed Martin Toyota,"Everyone was so friendly and helpful . They very definitely worked hard with us to get where we needed to be , and they did get there! 
My salesman, Kyle, was very helpful, very patient , and so thoughtful . I would highly
Recommend him . Also the gentleman who did the finance part of it was so good . Very knowledgeable and personable. And the gentleman who delivered my new car to me the next day, couldn’t have been more outgoing or polite . He genuinely
Was happy to deliver my beautiful, new car . And he shook my hand and thanked me for my business . It was a pleasure doing business with them . I will continue to do business with them",DealerRater,"everyone was so friendly and helpful . they very definitely worked hard with us to get where we needed to be , and they did get there! my salesman, kyle, was very helpful, very patient , and so thoughtful . i would highly recommend him . also the gentleman who did the finance part of it was so good . very knowledgeable and personable. and the gentleman who delivered my new car to me the next day, couldn’t have been more outgoing or polite . he genuinely was happy to deliver my beautiful, new car . and he shook my hand and thanked me for my business . it was a pleasure doing business with them . i will continue to do business with them",125,0.2933214962121212,0.9914,Positive
Ed Martin Toyota,"with a smile from the front desk. We were paired with Lucas Simerman as our sales person. Lucas was awesome to work with. He was knowledgeable, respectful and fun to talk to. It was not our intention to purchase a vehicle when we stopped in but after working with Lucas we knew this dealership was the one we wanted to work with. We did purchase a vehicle and finance manager James Schubert made the final process quick and easy. We will return to this location for future purchases.",DealerRater,"with a smile from the front desk. we were paired with lucas simerman as our sales person. lucas was awesome to work with. he was knowledgeable, respectful and fun to talk to. it was not our intention to purchase a vehicle when we stopped in but after working with lucas we knew this dealership was the one we wanted to work with. we did purchase a vehicle and finance manager james schubert made the final process quick and easy. we will return to this location for future purchases.",88,0.3583333333333334,0.8705,Positive
Ed Martin Toyota,vehicle quickly and Darnell made sure to meet all our requirements and concerns and we couldn’t be happier with our experience!,DealerRater,vehicle quickly and darnell made sure to meet all our requirements and concerns and we couldn’t be happier with our experience!,21,0.47916666666666663,0.7177,Positive
Ed Martin Toyota,"handed me the keys, the entire experience was absolutely wonderful! The process was smooth, clear, and stress-free — which is not something you can always say when buying a car. Everyone I interacted with was professional, responsive, and genuinely helpful. I never felt pressured, rushed, or left guessing. I’m so grateful for how easy Thankful and James made everything and would highly recommend this dealership to anyone looking for a positive car-buying experience!",DealerRater,"handed me the keys, the entire experience was absolutely wonderful! the process was smooth, clear, and stress-free — which is not something you can always say when buying a car. everyone i interacted with was professional, responsive, and genuinely helpful. i never felt pressured, rushed, or left guessing. i’m so grateful for how easy thankful and james made everything and would highly recommend this dealership to anyone looking for a positive car-buying experience!",73,0.2877424242424243,0.9834,Positive
Ed Martin Toyota,and not pushy at all towards us as buyers. Calmest but yet the most exciting dealership environment I’ve ever been in!!,DealerRater,and not pushy at all towards us as buyers. calmest but yet the most exciting dealership environment i’ve ever been in!!,21,0.484375,0.8191,Positive
Ed Martin Toyota,Very knowledgeable and thorough! Appreciate his delivering truck and all the instructions.,DealerRater,very knowledgeable and thorough! appreciate his delivering truck and all the instructions.,12,0.25,0.4574,Positive
Ed Martin Toyota,"through the buying process. 

We won't be going anywhere else to buy our Toyotas from now on!

Darnell, thanks for everything!",DealerRater,"through the buying process. we won't be going anywhere else to buy our toyotas from now on! darnell, thanks for everything!",21,0.25,0.5399,Positive
Ed Martin Toyota,"Ryan was responsive, honest, and overall great to work with. I typically hate buying through dealers but this was the complete opposite of all the negatives you typically expect. Thank you again.",DealerRater,"ryan was responsive, honest, and overall great to work with. i typically hate buying through dealers but this was the complete opposite of all the negatives you typically expect. thank you again.",32,0.07619047619047617,0.7469,Positive
Ed Martin Toyota,They care about making customers happy .sales teem are 10 out 10 .finance teem  are 10 ou 10 .mangameant are some of the best around they are iver alm gd team,DealerRater,they care about making customers happy .sales teem are 10 out 10 .finance teem are 10 ou 10 .mangameant are some of the best around they are iver alm gd team,31,0.9,0.9022,Positive
Ed Martin Toyota,"the process seamlessly and efficiently. We found the right truck with all the right features and I was given a fair price and financing terms. I would highly recommend Ed Martin Toyota, and Lane, for any car buying needs.",DealerRater,"the process seamlessly and efficiently. we found the right truck with all the right features and i was given a fair price and financing terms. i would highly recommend ed martin toyota, and lane, for any car buying needs.",39,0.3062857142857143,0.7778,Positive
Ed Martin Toyota,"Martin Toyota.  We worked with Moises Villa and Jason Conn both times.  They're great to work with - patient, friendly, and efficient.  Highly recommend.",DealerRater,"martin toyota. we worked with moises villa and jason conn both times. they're great to work with - patient, friendly, and efficient. highly recommend.",24,0.445,0.9168,Positive
Ed Martin Toyota,"The dealership made the car-buying process easy and comfortable, and everyone was friendly and welcoming. Ryan was especially great to work with; knowledgeable, patient, and genuinely helpful throughout the process. Everything was smooth and clearly explained. I’d absolutely recommend this dealership.",DealerRater,"the dealership made the car-buying process easy and comfortable, and everyone was friendly and welcoming. ryan was especially great to work with; knowledgeable, patient, and genuinely helpful throughout the process. everything was smooth and clearly explained. i’d absolutely recommend this dealership.",41,0.4135416666666667,0.975,Positive
Ed Martin Toyota,"have always used them for service. Mike Ball (sales), Josh (finance) and the rest of the employees are great to work with.",DealerRater,"have always used them for service. mike ball (sales), josh (finance) and the rest of the employees are great to work with.",22,0.8,0.6249,Positive
Kenny Kent Toyota,experence we ever had.,DealerRater,experence we ever had.,4,0.0,0.0,Neutral
Kenny Kent Toyota,"never been disappointed in the product, the sales process or the service department.",DealerRater,"never been disappointed in the product, the sales process or the service department.",13,-0.75,0.3724,Positive
Kenny Kent Toyota,over charged on licenses and title terrible,DealerRater,over charged on licenses and title terrible,7,-1.0,-0.5994,Negative
Kenny Kent Toyota,My salesman Kevin was very informative and great to deal with.,DealerRater,my salesman kevin was very informative and great to deal with.,11,0.5,0.6557,Positive
Kenny Kent Toyota,"Josh Brune helped me every step of the way with exceptional customer service!
Would definitely buy from them again!",DealerRater,josh brune helped me every step of the way with exceptional customer service! would definitely buy from them again!,19,0.41666666666666663,0.508,Positive
Kenny Kent Toyota,find the right vehicle within my budget. Not pushy and truly cared about helping.,DealerRater,find the right vehicle within my budget. not pushy and truly cared about helping.,14,0.2857142857142857,0.528,Positive
Kenny Kent Toyota,when we purchased our 2026 Highlander Hybrid.  He answered all our questions and gave us a “lesson” in operating the Highlander.,DealerRater,when we purchased our 2026 highlander hybrid. he answered all our questions and gave us a “lesson” in operating the highlander.,21,0.0,0.0,Neutral
Kenny Kent Toyota,"wonderful. Our salesman, Chris Brune was very fast and efficient. We do our research and are ready to purchase before we set foot in a dealership so the whole process was simple and great. Absolutely 5 stars across the board!",DealerRater,"wonderful. our salesman, chris brune was very fast and efficient. we do our research and are ready to purchase before we set foot in a dealership so the whole process was simple and great. absolutely 5 stars across the board!",40,0.3871428571428571,0.9281,Positive
Kenny Kent Toyota,service after the sale. Be sure and ask for Josh Brune. He is the best!,DealerRater,service after the sale. be sure and ask for josh brune. he is the best!,15,0.75,0.7777,Positive
Kenny Kent Toyota,"Crisply worked thru trade deal, extended the care plan bumper to bumper and on signing day that process was smooth.  Really great experience.",DealerRater,"crisply worked thru trade deal, extended the care plan bumper to bumper and on signing day that process was smooth. really great experience.",23,0.4833333333333334,0.8221,Positive
Kenny Kent Toyota,"Toyota Rav 4 at Kenny Kent Toyota. Jared our salesman was awesome, the best you could ask for. I would recommend him to anyone who goes to this dealership to purchase a vehicle.",DealerRater,"toyota rav 4 at kenny kent toyota. jared our salesman was awesome, the best you could ask for. i would recommend him to anyone who goes to this dealership to purchase a vehicle.",33,1.0,0.8957,Positive
Kenny Kent Toyota,"The staff was very friendly, knowledgeable, and efficient. I'm loving my new-to-me vehicle!",DealerRater,"the staff was very friendly, knowledgeable, and efficient. i'm loving my new-to-me vehicle!",13,0.61875,0.8881,Positive
